{
  "schema": "pulsetensor/evaluation-reveal/v1",
  "evaluationVersion": "1",
  "chainId": 943,
  "evaluationContract": "0x5555555555555555555555555555555555555555",
  "taskId": "0xaaaaaaaaaaaaaaaaaaaaaaaaaaaaaaaaaaaaaaaaaaaaaaaaaaaaaaaaaaaaaaaa",
  "receiptHash": "0x1515151515151515151515151515151515151515151515151515151515151515",
  "evaluationPolicyHash": "0x0101010101010101010101010101010101010101010101010101010101010101",
  "evaluator": "0x6666666666666666666666666666666666666666",
  "scoreVector": [
    {
      "criterionId": "0x1616161616161616161616161616161616161616161616161616161616161616",
      "scoreBps": 9200
    },
    {
      "criterionId": "0x1717171717171717171717171717171717171717171717171717171717171717",
      "scoreBps": 8700
    },
    {
      "criterionId": "0x1818181818181818181818181818181818181818181818181818181818181818",
      "scoreBps": 8100
    }
  ],
  "evidenceRoot": "0x1919191919191919191919191919191919191919191919191919191919191919",
  "salt": "0x2020202020202020202020202020202020202020202020202020202020202020",
  "evaluatorNonce": "3",
  "evaluatorSignature": "0x3333333333333333333333333333333333333333333333333333333333333333333333333333333333333333333333333333333333333333333333333333333333"
}
